{
  "schema_version": "1.1.0",
  "app_id": "docvault-lasttime-fusion",
  "display_name": "DocVault + LastTime Fusion",
  "active_for_selection": true,
  "lifecycle_state": "PAUSED",
  "phase": "ANDROID_J1_PASSED_IOS_EXECUTOR_BLOCKED",
  "updated_at": "2026-09-03T19:09:08Z",
  "state_revision": 20,
  "last_event_sequence": 20,
  "delivery_plan_id": "docvault-lasttime-fusion-v0.1",
  "last_completed_event": {
    "event_type": "ANDROID_J1_UI_PASSED_LOCAL_FALLBACK",
    "occurred_at": "2026-09-03T19:09:08Z",
    "summary": "Android Journey J1 passed through the installed UI on the optional Windows emulator executor: encrypted create, process force-stop, relaunch, search, decrypt, and reopen. The source, tested APK, screenshot, test evidence, and checksums are stored in cloud repositories/Drive. Product PR 3 merged after equivalent local gates passed; hosted jobs did not start because GitHub reported a billing/spending-limit condition. Cross-platform work is paused before iOS J1 until an authorized macOS executor is available."
  },
  "next_safe_action": "Restore GitHub Actions execution within the approved budget or provide an authorized macOS executor, then wire and validate iOS Journey J1. Preserve the accepted Android J1 evidence unless relevant source changes. Do not enable paid overage, repeat blocked hosted jobs, or call the release complete without the remaining journey and signing gates.",
  "blockers": [
    {
      "id": "HOSTED_ACTIONS_BILLING_BLOCKED",
      "summary": "GitHub refused job start because of an account payment/spending-limit condition. The available optional host is Windows and cannot run the remaining iOS Simulator gate. No paid overage is authorized.",
      "url": "https://github.com/jawadresearchai-creator/appfusion-product/actions/runs/33794502740"
    }
  ],
  "artifact_locations": {
    "product_repository": "jawadresearchai-creator/appfusion-product",
    "drive_workspace_id": "1QGCWL7rabO2NuXm83xKXrNaGLvnXsvpt",
    "source_bundle_manifest_file_id": "12Qjms57CorUzpMqPrQ9dh8TrS3slxN5M",
    "application_state_file_id": "1kurtVziDCgOGXvPujRaW5JrYPBQ9SkgX",
    "product_blueprint_sha256": "2120f5989ec35562377bd42e032018bd0004916d5ea4c56005f8e7048414b6fc"
  }
}
